,query,carb
0,A large gluten-free roll is part of my meal.,26.2444
1,"For my meal, I am having a single pickled pig's foot.",0.0085
2,Enjoying a piece of chocolate candy.,4.752
3,Consuming dried nutmeat made from butternut.,0.3615
4,I am consuming 3 ounces of cooked braised beef chuck blade roast that has been trimmed of all fat.,0.0
5,"A cup filled with baked cubes of winter hubbard squash, seasoned without salt.",22.1605
6,"For breakfast, I'm enjoying a single frozen whole grain pancake.",15.42
7,Feeding my baby 1 fluid ounce of store brand infant formula prepared with tap water.,2.1716
8,"For dinner, I am enjoying a boneless chuck eye roast that has been cooked and roasted.",0.0
9,Enjoying a slice of reduced-fat pastrami sourced from a type of meat.,0.1792
10,"For dessert, I am enjoying a strawberry pie.",66.33
11,"A serving of Boston blade pork shoulder, cooked and roasted, weighing 3 ounces.",0.0
12,A cup of diced low sodium sour pickles is my snack.,3.2318
13,"For dinner, I am enjoying a cup of Valenciana-style paella that includes meat.",38.3346
14,A large chocolate candy that is filled with coconut is my snack.,51.309
15,"A personal-sized pizza topped with cheese and vegetables, served on a gluten-free thin crust.",43.3952
16,Enjoying a piece of peanut brittle as a snack.,7.124
17,"I consumed a pre-cooked quarter of a baked chicken breast, including the skin.",0.1395
18,"For dinner, I am enjoying a cup of cooked dove that has been diced.",0.0
19,"A medium-sized chocolate cake doughnut, glazed and sprinkled with sugar.",24.108
20,"Utilizing a teaspoon of hydrogenated palm kernel oil, known as an industrial confection fat.",0.0
21,"For dinner, I am enjoying a cup of T-bone steak.",0.0
22,"I am preparing 4 ounces of raw chicken wings, including both the meat and skin.",0.0
23,A cup filled with diced raw rhubarb.,5.5388
24,"A slice of toasted pumpernickel bread, excluding the crust.",20.358
25,"I am getting ready to cook a whole leg of Australian lamb weighing roughly a pound, including both the shank and sirloin, and it has been trimmed to 1/8 inch of fat.",0.0
26,"I am enjoying 3 ounces of broiled New Zealand lamb loin, trimmed to an eighth of an inch of fat.",0.0
27,A medium baked potato topped with chili.,56.6055
28,"Dinner consists of a whole perch fish, either baked or broiled.",21.033
29,Consuming 1 ounce of raw pancreas from beef.,0.0
30,Consuming a raw Japanese persimmon that measures approximately 2.5 inches across.,31.2312
31,"I possess a 4-ounce piece of raw flank steak, trimmed to eliminate any fat.",0.0
32,"Enjoying a cup of canned pears packed in heavy syrup, including both the fruit and syrup.",50.9922
33,"For my meal, I am having 3 ounces of smoked chinook salmon.",0.0
34,"For dinner, I'm enjoying 3 ounces of braised boneless beef chuck short ribs.",0.0
35,"Enjoying a frozen Chocolate Eclair by Weight Watchers, produced by Heinz.",23.777
36,"For a snack, I am enjoying a jar of Heinz Strained banana pudding.",16.968
37,A small iced mocha coffee made with non-dairy milk.,32.736
38,I have a cup of freshly cooked peas and carrots without any added fat.,19.968
39,"For a snack, I am enjoying 1 ounce of lightly salted cashews.",8.944425
40,"For dinner, I'm enjoying a can of traditional refried beans.",59.891
41,A cubic inch of lean pork steak is my meal.,0.0
42,A cup of toasted sesame seeds seasoned with salt.,33.3312
43,"Enjoying a raw feijoa fruit as a snack, skin removed.",6.3882
44,"In my dish, I incorporated a tablespoon of ready-to-serve oyster sauce.",1.9656
45,"A porterhouse steak, raw and trimmed to an eighth of an inch of fat.",0.0
46,A medium-sized soft pretzel is being enjoyed as a snack.,83.256
47,Enjoying a biscuit stuffed with a crispy chicken fillet as a snack.,40.3392
48,"For my meal, I am having a slice of grilled chicken served without any sauce and without the skin.",0.0
49,"For lunch, I'm enjoying a can of condensed tomato beef soup with noodles, weighing 10.75 ounces.",51.4535
50,Enjoying a 14-inch cheese pizza with a crunchy thin crust from Domino's.,152.172
51,"A 3-ounce piece of choice chuck beef, specifically the top blade, has been broiled and trimmed to zero fat.",0.0
52,"I possess 4 ounces of raw boneless rib eye steak, trimmed to an eighth of an inch in fat.",0.0
53,A piece of cooked tip round roast with the fat trimmed to 1/8 inch.,0.0
54,A small diet soft drink with a chocolate flavor.,1.044
55,Enjoying a cheese quesadilla that measures approximately 8 to 10 inches across from a Mexican restaurant.,46.7734
56,"A bowl of beef and noodles accompanied by vegetables, minus the carrots and broccoli, all smothered in a tomato sauce.",37.0014
57,"For dinner, I'm having a single heart.",0.0045
58,I am serving a tablespoon of Stage 1 Baby Toddler carrots to my toddler.,0.9
59,"As a snack, I am enjoying 1 ounce of boiled and steamed European chestnuts.",7.86996
60,"I intend to prepare a roast of boneless rib eye steak, trimmed to 1/8 inch of fat.",0.0
61,A small single-serving bag of flavored popped potato chips is being consumed.,19.8912
62,"A pound of beef tenderloin steak, cooked and broiled, with 1/8 inch of fat trimmed off.",0.0
63,"For dessert, I am enjoying a single coconut cream pie.",47.58
64,"A cup of whole grain pasta topped with cream sauce, seafood, and vegetables, ready to be heated.",41.075
65,"For a snack, I am enjoying 1 ounce of plain salted potato chips.",15.0724
66,A cup containing chocolate candy filled with coconut.,91.216
67,"Consuming 3 ounces of freshly cooked pork, featuring cuts from the leg, loin, and shoulder.",0.0
68,"Enjoying half a cup of canned sweet red peppers, with both solids and liquid included.",2.73
69,"A cup of canned beets, prepared without added salt.",16.1622
70,"A cup of egg omelet made with meat, tomatoes, and dark-green vegetables, prepared without any added fat.",2.052
71,Dinner includes a cup of sautéed chicken that has been cooked and diced.,0.0
72,A king-size piece of hard candy enjoyed.,117.6
73,Preparing a 4-ounce boneless top blade steak that has been trimmed to no fat from the shoulder.,0.0
74,"A cup of egg omelet featuring tomatoes and dark-green vegetables, prepared without added fat.",2.0385
75,Preparing a single piece of raw dark meat chicken with skin sourced from a pound of ready-to-cook chicken.,0.0
76,A large iced mocha coffee prepared with non-dairy milk.,54.56
77,"In my cooking, I included 1 fluid ounce of coconut milk, served over ice.",1.662
78,"A slice of American cheese with reduced fat content, enriched with vitamin D.",2.014
79,"A can of cream of potato soup, prepared and ready to eat, weighing approximately 10.75 ounces.",27.871
80,"A cup of cooked frozen asparagus, prepared without any added fat.",3.438
81,Enjoying a cup filled with dry roasted macadamia nuts that have no added salt.,17.6616
82,"I am getting ready to cook a 3-ounce portion of boneless Australian lamb leg sirloin, trimmed to a quarter-inch of fat.",0.0
83,A small piece of barley bread is what I'm having.,13.3112
84,Dinner consists of a whole grilled pompano fish.,0.0
85,A tablespoon of chocolate dip is being enjoyed.,13.062
86,Consuming 1 ounce of dry Cream of Wheat prepared with water and a bit of fat.,21.2995
87,Consuming a quart of 1% milk that does not have added vitamin A or D.,48.7024
88,Dinner consists of a cup of crab.,0.0
89,Dinner consists of a cup of smoked fish.,0.0
90,Savoring a one fluid ounce serving of Turkish coffee.,2.0057
91,"A 12 fluid ounce can of cola that is low in calories, sweetened with aspartame and caffeine-free.",0.426
92,"A half cup of boiled garden cress, cooked and drained without any salt.",2.584
93,A tub of Stage 2 Baby Toddler apples is what I'm eating.,11.33
94,"For dinner, I will be eating 1 ounce of strained mixed vegetable baby food.",2.69325
95,A small slice of bruschetta for a snack.,2.9848
96,"For a snack, I am enjoying 10 Chicken McNUGGETS from McDONALD'S.",23.9931
97,Enjoying a serving of 10 small onion rings that have been breaded and par-fried before being heated in the oven.,16.8216
98,"For dinner, I'm enjoying a thick pork chop made from lean meat.",0.0
99,A cup of baby food containing peas and brown rice.,26.427
100,"A cup of roasted potatoes, prepared with fresh potatoes and their skins intact, cooked in oil.",32.72
101,"A cooked top sirloin steak weighing 3 ounces, broiled and with no fat.",0.0
102,"I am consuming one ounce of knackwurst, a type of knockwurst that consists of pork and beef.",0.9072
103,"I prepared an omelet filled with dark-green vegetables, without any added fats.",0.994
104,"For dessert, I am enjoying an apple cupcake.",47.268
105,"A small toasted plain bagel, approximately 3 inches wide, enriched with calcium propionate and topped with onion, poppy, and sesame seeds.",37.3035
106,"For dinner, I'm enjoying a grilled top loin steak.",0.0
107,"For breakfast, I am enjoying a large muffin filled with blueberries.",73.67
108,"I am consuming 3 ounces of braised beef chuck arm pot roast, trimmed to an eighth of an inch of fat.",0.0
109,Enjoying a single school potato tot as a snack.,1.5472
110,"For a snack, I enjoyed a tablespoon of junior applesauce.",1.648
111,A cup of cooked pigeon peas seasoned with salt.,29.8197
112,"For dinner, I'm enjoying a small baked fillet of perch.",0.009
113,"A cup containing a baked whole egg, prepared without any added fat.",1.296
114,"I have 1 ounce of choice rib lamb, trimmed to a quarter-inch of fat and uncooked.",0.0
115,"For dinner, I am enjoying a cup of CAMPBELL'S CHUNKY Hearty Beef Barley Soup.",18.4988
116,A teaspoon of high oleic sunflower oil is being used in my cooking.,0.0
117,"A cup of beef stew prepared in a Mexican style with a tomato sauce, excluding potatoes.",8.174
118,"For dinner, I am enjoying a cup of cooked millet.",40.069
119,Consuming 3 ounces of cooked New Zealand beef that contains intermuscular fat.,2.8815
120,"For a snack, I am enjoying 1 ounce of baby food made from strained pineapple fruit pudding.",5.75505
121,A cup of Vault energy drink that is sugar-free.,1.6800000000000002
122,Dinner consists of a cup of ground lamb.,0.0
123,"For dinner, I am enjoying a cup of grilled pompano fish.",0.0
124,A cup of boiled potatoes prepared with oil and without the peel.,32.72
125,A cup of fat-free French dressing is being added to the salad.,82.2784
126,"For breakfast, a regular egg sandwich made with an English muffin and sausage.",28.836
127,A cup of New England clam chowder prepared with 2% low fat milk.,18.7992
128,"For dinner, I’m enjoying a large fillet of fish, either baked or broiled.",0.0135
129,"Enjoying an ounce of homemade oatmeal cookies, free from raisins.",18.8244
130,I consumed a fluid ounce of ready-to-drink Abbott Ensure Plus.,6.2622
131,"For lunch, I am enjoying a peanut butter and jelly sandwich.",50.6464
132,"A 6-ounce jar of Gerber Third Foods featuring macaroni, tomato, and beef.",15.98
133,A slice of cooked cucumber is my choice for a snack.,0.414
134,A cup of lightly salted cashews enjoyed as a snack.,41.015
135,"For dinner, I'm enjoying a medium-sized baked chicken thigh, skin removed.",0.0
136,A regular sausage biscuit sandwich is my breakfast today.,29.931
137,A teaspoon of either red pepper or cayenne spice is being utilized.,1.01934
138,"For dinner, I am enjoying a broiled lamb chop from New Zealand, cooked to perfection.",0.0
139,A snack consisting of a cracker sandwich filled with peanut butter.,4.0866
140,"A cup of brown rice combined with peas, prepared without any added fat.",43.1409
141,"For dinner, I am serving a whole roasted boneless cured ham.",29.3119
142,Enjoying a serving of white Muscat wine that measures 5 fluid ounces.,7.845
143,"A serving of pizza topped with cheese and a regular crust, cooked and ready to eat.",23.5062
144,Enjoying a snack-sized microwavable tray of Spaghettios featuring whole grain pasta in a tomato-based sauce with meat and vegetables.,30.753
145,A regular sandwich loaded with various meats purchased from a restaurant.,31.7625
146,A quarter cup of CLASSICO basil pesto sauce is prepared for serving.,4.2966
147,"A slice of Beerwurst, a pork-based beer salami.",0.4738
148,"Enjoying a small slice of multigrain bread that has been toasted, which is low in calories and high in fiber.",7.4025
149,"For dinner, I am enjoying a roasted drumstick of chicken with the skin on.",0.0
150,A cubic inch of low sodium mozzarella cheese is my snack.,0.558
151,"For dinner, I'm enjoying 3 ounces of slow-roasted lamb shoulder from New Zealand.",0.0
152,"For lunch, I’m enjoying a cup of egg salad prepared with light mayonnaise.",6.2604
153,"For dinner, I'm enjoying a cup of fried catfish.",15.822
154,"For lunch, I'm enjoying a sandwich made with a chicken fillet.",38.472
155,A cup of egg omelet made with tomatoes and no fat added.,2.0925
156,"For lunch, I am enjoying a small chicken salad sandwich made with wheat bread.",15.309
157,"For dinner, I'm enjoying a slice of pork belly.",0.0
158,I had a cup of Spanish rice when dining at the Mexican restaurant.,36.1456
159,"For breakfast, I enjoyed a cup of an omelet made with scrambled egg whites.",2.9835000000000003
160,I possess 3 ounces of fresh raw skipjack tuna.,0.0
161,"Providing my baby with 1 fluid ounce of Gentlease infant formula, ready to feed, by MEAD JOHNSON, enriched with ARA and DHA.",2.283
162,Enjoying a sandwich made with Nutella spread on wheat bread as a snack.,46.179
163,Enjoying a cup of nachos from NFS as a snack.,32.1165
164,"I have three flowerets of boiled cauliflower, drained and sprinkled with a bit of salt.",2.2194
165,A 16.9 fluid ounce bottle of Poland Spring water is being consumed.,0.0
166,"For a snack, I enjoyed a cup of reduced fat butter crackers.",35.76
167,Utilizing a cup of salted butter in my recipe.,0.1362
168,A cup of cheese hash browns that are ready to heat.,38.336
169,"A serving of broiled porterhouse steak, sourced from the short loin and carefully trimmed to remove any fat.",0.0
170,A jar filled with toddler vegetables mixed with grain is being consumed.,13.211
171,"For dinner, I am enjoying a grilled top sirloin filet that has been cooked.",0.0
172,A cup of fettuccini made from gluten-free brown rice flour by TINKYADA is being enjoyed.,49.266
173,"For my meal, I am enjoying a spiral slice of cured ham weighing 3 ounces, served with its natural juices.",1.037
174,"I am consuming 4 ounces of boneless, trimmed eye of round roast beef that is lean.",0.0
175,"For dinner, I'm enjoying a piece of strip steak, prepared to my preference.",0.0
176,"I possess a 4-ounce portion of raw boneless chuck beef pot roast, with all fat trimmed off.",0.2147
177,Enjoying a cubic inch of peach cobbler as my dessert.,4.947
178,A cubic inch portion of corned beef.,0.0799
179,"I'm enjoying an omelet made with eggs, tomatoes, and dark green vegetables, along with added fat.",1.08
180,"A bottle of DANNON water, which is non-carbonated and contains fluoride.",0.0753
181,"Utilizing a tablespoon of margarine-like shortening, ideal for making flaky pastries.",0.0
182,I possess a fully trimmed boneless beef shoulder pot roast with zero fat.,0.0
183,A medium-sized soft pretzel sprinkled with cinnamon sugar is my snack.,108.7653
184,"A cup of macaroni and cheese with meat, prepared using a Hamburger Helper mix.",23.621
185,"For breakfast, I'm enjoying a wheat English muffin studded with raisins.",27.8052
186,"For dinner, I am enjoying 3 ounces of braised New Zealand lamb neck chops.",0.0
187,A cup of nonfat milk enriched with calcium.,11.9795
188,Having a snack of 1 ounce of plain salted potato chips made with partially hydrogenated soybean oil.,14.99715
189,A cup of tomato soup made from a dry mix combined with water.,19.0005
190,A cup of freshly cooked cauliflower with added fat.,8.032
191,Ten salted hard pretzels crafted from unenriched flour are my snack.,47.52
192,"A regular sandwich made with an egg and ham, served on an English muffin.",27.985
193,Utilizing a tablespoon of shortening that is a cake mix created with hydrogenated soybean and cottonseed oil.,0.0
194,"A serving of red Mouvedre table wine, measuring 5 fluid ounces.",3.8808
195,"A serving of baby corn from a can with reduced sodium, sautéed in butter.",1.1584
196,"I am having 3 ounces of cooked, broiled boneless center rib pork loin chops.",0.0
197,A package of macadamia nuts is being enjoyed as a snack.,6.415
198,Enjoying a hard pretzel chip that is gluten-free.,2.0709
199,"For dinner, I will be enjoying 3 ounces of roasted bone-in center loin pork.",0.0
200,Enjoying a cheese pastry puff measuring approximately 5 inches in length.,0.804
201,A small whole wheat roll is included in my meal.,33.58
202,"A slice of commercially made egg custard pie, representing one-sixth of an 8-inch pie.",21.84
203,Dinner includes a serving of 3 ounces of cooked and roasted tip round beef roast.,0.0
204,A small chocolate candy filled with nougat.,7.447
205,Consuming a jar of junior apple and blueberry fruit puree for a meal.,28.22
206,A commercially prepared and refrigerated piece of whole wheat naan bread.,48.9826
207,"A 3-ounce slice of bone-in cured ham, which is lean and not heated.",0.0
208,A package of granola bites with assorted flavors is my snack.,13.254
209,Preparing a fresh pork chop weighing approximately 151 grams from a loin.,0.0
210,"A tablespoon of yogurt for babies, prepared with whole milk, fruit, multigrain cereal, and supplemented with iron.",2.08
211,A regular piece of chocolate cake without any icing.,28.132
212,A cup of white rice accompanied by vegetables and gravy.,48.438
213,A packet of active dry baker's yeast is being utilized for baking.,2.96784
214,A tablespoon of reduced sodium ketchup is what I’m having.,4.658
215,Consuming 3 ounces of grilled inside skirt steak that has been cooked.,0.0
216,"A cup of raw European chestnuts, unpeeled, is my snack.",66.033
217,A prepackaged single portion of corn squares cereal is being consumed for breakfast.,23.142
218,A 12 fluid ounce can of low-calorie cola containing aspartame and caffeine.,1.0295
219,A quart of reduced fat milk containing 2% milkfat and added nonfat milk solids.,53.802
220,A fry topped with chili from a fast food place.,2.5264
221,"I prepared a beverage using 2 tablespoons of decaffeinated green tea powder, combined with lemon and enhanced with vitamin C.",4.25025
222,A cup filled with pieces of bologna for my lunch.,8.834
223,A medium portion of drained canned mushrooms is being consumed.,0.6108
224,"For my meal, I prepared 1 ounce of dried lima beans.",13.968
225,A cup of corn drink is what I'm enjoying.,24.44
226,Enjoying a tablespoon of jam made with fruit juice sweetener.,10.586
227,A packet of instant plain oatmeal prepared with non-dairy milk.,23.236
228,"For my stir-fry, I am including one-third of a package of frozen chopped green sweet peppers.",4.2275
229,"For dinner, I am enjoying a serving of simmered pork ears.",0.844
230,"For lunch, I am enjoying a fried seafood sandwich.",44.406
231,I placed an order for a meal featuring shrimp along with a variety of vegetables from a Chinese restaurant.,27.1652
232,"For my meal, I'm enjoying a cup of chopped roasted chicken.",0.0
233,Consuming a single strip of pimiento.,0.0624
234,I am getting ready to cook half of a raw pheasant breast that has been deboned and skinned.,0.0
235,A breakfast consisting of a cup of scrambled egg white omelet cooked in butter.,2.97
236,A cup of barbecue pork served without sauce.,0.0
237,Dinner consists of 3 ounces of roasted chicken thigh.,0.0
238,"For dinner, I am enjoying a piece of sirloin steak.",0.0
239,"I enjoyed a cup of steak, though I can't specify the meat's type or its fat content.",0.0
240,Cooking a single piece of boneless beef chuck short ribs that has been trimmed of fat.,0.216
241,Enjoying a Quaker Chewy granola bar with 25% less sugar as a snack.,16.656
242,"A grilled chicken wrap filled with lettuce, cheese, and ranch sauce, all wrapped in a tortilla.",22.6689
243,A slice of pork chop featuring both lean meat and some fat.,0.003
244,"For dinner, I'm enjoying a cup of pasta topped with tomato sauce and cheese.",37.45
245,"For lunch, I am enjoying a standard egg salad sandwich made with white bread.",30.726
246,A cup of air-popped popcorn without salt is my snack.,6.232
247,"Preparing a boneless chuck eye roast, which is a cut of America's Beef Roast with all fat trimmed off.",0.0
248,A cup of paneer cheese is included in my meal.,55.2516
249,Consuming a cubic inch of low-fat bologna made from beef and pork.,0.364
250,I ordered a 14-inch thin and crispy crust pepperoni pizza from Pizza Hut.,207.0644
251,Consuming a tablespoon of dry farina cereal that is unenriched.,8.502
252,"For dinner, I'm enjoying a cup of broccoli casserole accompanied by rice.",34.4052
253,"A cup of raw fireweed leaves, chopped, served as a side.",4.4206
254,"For dessert, I'm enjoying a slice of key lime pie that measures one surface inch.",7.95312
255,"For dessert, I'm enjoying a 5-ounce can of ready-to-eat rice pudding.",26.1138
256,A thick slice of cooked smoked or cured pork bacon with lower sodium content.,0.1716
257,Enjoying a quarter cup of jellied cranberry sauce by OCEAN SPRAY.,28.427
258,"I consumed a reduced sugar fruit-flavored beverage, measuring 1 fluid ounce, that contains over 3% fruit juice and is enriched with vitamin C and added calcium.",2.07437
259,"Enjoying a single wing from KFC's ORIGINAL RECIPE fried chicken, stripped of skin and breading.",0.4048
260,Sipping on 1 fluid ounce of diet chocolate cola served with ice.,0.0667
261,Enjoying a whole grilled white fish for my evening meal.,0.0
262,I prepared an ounce of Irish soda bread following a recipe.,15.876
263,"A large bag of flavored potato chips, intended as a single serving.",60.384
264,"In my cooking, I am utilizing a tablespoon of low linolenic soy oil.",0.0
265,"A raw top chuck shoulder steak, expertly trimmed to have no fat, and prepared for cooking.",0.0
266,"A serving of 1 ounce of cooked rotisserie chicken leg, consisting of the drumstick and thigh, with the skin removed.",0.0
267,A large boiled potato prepared and ready for heating.,61.35
268,"For my meal, I am enjoying 1 ounce of carnitas pork.",0.0
269,"A serving of braised choice beef short ribs, weighing 3 ounces.",0.0
270,"For lunch, I am enjoying a 19-ounce can of Manhattan-style clam chowder.",42.2576
271,Snacking on a single raw kumquat.,3.021
272,"For dinner, I am enjoying a cup of fish timbale.",3.15
273,Enjoying a cup of creamy asparagus soup prepared with milk.,16.5664
274,A full cup of drained canned beets is my choice.,11.7523
275,A can of cream of celery soup made with the same amount of milk.,35.2772
276,"A slice of reduced fat Muenster cheese, roughly the size of a cracker.",0.315
277,I possess a single ounce of Florida pompano fish in its raw state.,0.0
278,A cup of strained baby food that includes vegetables and carrots.,13.44
279,"A cup of brown rice combined with cheese and a creamy sauce, without any added fat.",54.3197
280,"A cooked bottom round roast prepared from premium beef, trimmed to have no fat, made from 572 grams of raw meat.",0.0
281,"For breakfast, I am enjoying a serving of Thomas English Muffins produced by George Weston Bakeries.",26.22
282,A tablespoon of multigrain toddler cereal mixed with fruit.,3.05786
283,I am enjoying a 3-ounce serving of caramel custard flan prepared from a dry mix.,77.86
284,Cooking 4 ounces of raw chicken thighs with the skin for dinner.,0.2825
285,A fried chicken breast without the skin or breading.,0.0
286,"For dinner, I am enjoying a cup of chunky chicken vegetable soup that includes potatoes and cheese.",12.74
287,A thin slice of rye bread with reduced calories.,8.1
288,A serving of chocolate-flavored cola soft drink with ice measures 1 fluid ounce.,2.3828
289,A personal-sized pizza topped with cheese and vegetables on a thick whole wheat crust.,68.976
290,"A large, raw head of green cauliflower is in my possession.",31.1199
291,"I am consuming five slices of raw ginger root, approximately one inch across.",1.9547
292,"For dinner, I will be eating a cup of cooked brown and wild rice.",29.715
293,"I possess one pound of raw choice lamb shoulder, with the fat trimmed to an eighth of an inch.",0.0
294,A jar containing 2.5 ounces of strained banana baby food that does not include tapioca.,15.1514
295,I got a portion of nachos topped with chicken and beans.,45.55
296,"A large bowl of whole grain pasta topped with cream sauce, seafood, and mixed vegetables, heated in the microwave.",67.5273
297,"A boneless chuck eye roast from America's Beef Roast, completely raw and trimmed to zero fat.",0.0
298,A package of regular dry mix for banana pudding is being prepared with the addition of oil.,77.792
299,"A jar of fruit baby food containing bananas, pineapple, and tapioca.",31.28
300,"A cup of chow mein or chop suey, without noodles, accompanied by an unspecified type of meat.",8.448
301,A cup filled with chopped raw chicory greens.,1.363
302,"A large slice of boiled onions, drained and served without salt.",3.248
303,A small barbecue beef sandwich served on a wheat bun.,21.231
304,I enjoyed one baked chicken wing from a fast food place.,0.0
305,"For dinner, I am enjoying a large bowl of whole grain pasta topped with cream sauce and mixed vegetables, heated in the microwave.",67.3218
306,I scooped one tablespoon of multipurpose shortening that consists of hydrogenated soybean and palm oils.,0.0
307,A ladyfinger cookie is my chosen snack.,6.567
308,Preparing 1 pound of raw giblets from a broiler chicken for cooking.,0.414
309,I prepared 1 ounce of cooked kidney beans with added fat.,15.2568
310,Prepared a 16-ounce package of instant beef gravy.,277.394
311,Enjoying 8 pods of boiled okra seasoned with a touch of salt.,3.8335
312,"A cup of vegetable oil spread that resembles margarine, containing 20% fat and salt.",0.96
313,I possess 4 ounces of raw beef tongue from New Zealand.,0.0
