,query,carb
5699,I am consuming one ounce of creamed dried coconut meat.,6.10092
5700,"For my meal, I am enjoying 3 ounces of pan-fried top sirloin steak, with 1/8 inch of fat trimmed off.",0.0
5701,A cup filled with almond paste.,108.5287
5702,Enjoying a cooked ounce of baked chicken drumstick from a fast food restaurant.,0.0
5703,"Enjoying an ounce of regular trail mix containing chocolate chips, salted nuts, and seeds.",12.72915
5704,A large iced latte made with nonfat milk.,16.92
5705,"For dinner, I'm enjoying a serving of potato in a cup.",32.72
5706,A cup of cooked canned green beans with added fat.,5.8
5707,A cup of New England clam chowder made with an equal amount of water.,12.524
5708,Consuming 1 fluid ounce of rice sake.,1.455
5709,A cup of mashed canned carrots prepared with added fat.,12.643
5710,Enjoying a cup of strawberry pie as my dessert.,110.55
5711,"For dinner, I will be enjoying a piece of lean strip steak.",0.0
5712,"A large grilled chicken breast served with sauce, skin included.",14.313
5713,"For dinner, I am preparing a raw boneless inside skirt steak that has been trimmed of all fat.",0.0
5714,"For dessert, I am enjoying a tablespoon of baby food vanilla custard pudding.",2.24
5715,Enjoying a medium-sized bag of multigrain hard pretzels as a snack.,45.6456
5716,"For dinner, I'm enjoying a bag of BBQ rotisserie chicken.",0.728
5717,"For dinner, I will be enjoying a can of red kidney beans.",64.6588
5718,"A small golden delicious apple, eaten raw with its skin intact.",17.544
5719,A serving of cooked leeks in a cup for my meal.,25.058
5720,"For dinner, I am consuming 1 ounce of fresh, raw pork heart.",0.377055
5721,A 2.5-ounce jar of strained prunes from Gerber First Foods is part of my meal.,16.6992
5722,A teaspoon of concentrated lemon juice is being consumed.,0.281
5723,A cup filled with walnut oil.,0.0
5724,Enjoying a cup filled with hot dogs accompanied by sauerkraut.,5.0274
5725,"A cup of garden salad featuring chicken along with vegetables such as tomatoes and carrots, served without dressing.",2.466
5726,Enjoying a cup of chocolate cheesecake as my dessert.,64.782
5727,A bag of tortilla chips with a taco flavor is my snack.,143.237
5728,"Consuming half a cup of raw beet greens, chopped into one-inch segments.",0.8227
5729,I am consuming one nopales pad that has been cooked without any salt.,0.9512
5730,Enjoying a 14-inch thick crust pizza topped with sausage from a popular fast food chain.,308.7612
5731,Feeding my baby a 1-ounce serving of junior macaroni with tomato and beef.,2.6649000000000003
5732,Enjoying a pack of STARBURST Sour Fruit Chews weighing 2.07 ounces.,47.0407
5733,"For a snack, I am enjoying a sprig of raw garden cress.",0.055
5734,Consuming a cup of fluid replacement solution containing 5% glucose in water.,0.288
5735,"For dinner, I am enjoying a cup of fried chicken made from light meat.",0.588
5736,"Enjoying half of a roasted chicken, with the bones taken out.",0.0
5737,"For my meal, I'm using 0.33 cup of chicken-flavored RICE-A-RONI.",42.6048
5738,A cup filled with a scrambled egg white omelet that includes mixed meat.,2.889
5739,Consuming 4 ounces of imported raw beef kidney from New Zealand.,0.0
5740,"For my meal, I'm using a tablespoon of dried buttermilk.",3.185
5741,A single canned rambutan in syrup is being enjoyed.,1.8783
5742,"Enjoying a piece of coffee cake topped with cheese, approximately one-sixth of a 16-ounce cake.",33.668
5743,"A boneless rib eye steak, carefully trimmed to remove any fat.",0.3912
5744,Enjoying a cracker spread with reduced sodium butter.,2.058
5745,"A serving of junior apple and raspberry fruit baby food, weighing 1 ounce.",4.3659
5746,A quarter cup of shallots that have been freeze-dried.,2.9052
5747,"For dinner, I'm enjoying 3 ounces of grilled top sirloin cap steak.",0.935
5748,A thin slice of pumpernickel bread is being enjoyed.,9.5
5749,A serving of raw orange juice measured at one fluid ounce.,3.224
5750,I possess a pound of raw round tip beef that has had the fat trimmed to an eighth of an inch.,0.0
5751,"Enjoying a 6-inch SUBWAY sub filled with black forest ham, served on white bread with fresh lettuce and tomato.",42.1544
5752,"A slice of commercially made apple pie, representing one-eighth of a 9-inch pie.",42.5
5753,"For dinner, I am enjoying a cup of steamed bass.",0.0
5754,A turkey frankfurter weighing 1 ounce is my snack.,1.080135
5755,"A cup filled with pieces of injera, the traditional Ethiopian bread.",12.4372
5756,"A cup of long-grain white rice, cooked and seasoned with salt.",44.5086
5757,Consuming one fluid ounce of celery juice.,3.5046
5758,"A single slice of a 9-inch standard pie crust, baked and cut into one-eighth.",10.08
5759,Enjoying a cup of powdered coffee creamer that is sugar-free and flavored.,55.7326
5760,A small fillet of baked catfish is my dinner.,0.009
5761,"For dinner, I am enjoying a single cheese-stuffed chiles rellenos.",14.6432
5762,A ball of Puerto Rican style green plantain accompanied by cracklings.,17.2608
5763,A slice of toasted low sodium white bread weighing 1 ounce.,15.4224
5764,A cubic inch of tuna fish is my meal.,0.0136
5765,Dinner consists of a cup of Puerto Rican style rice accompanied by chicken.,38.308
5766,"Prepared a cup of mashed potatoes using dehydrated flakes, excluding milk.",48.702
5767,A plain dosa measuring one square inch in size.,0.3704
5768,Consuming half an ounce of Hershey's unsweetened baking chocolate squares.,4.03564
5769,"For breakfast, I am enjoying an omelet made with eggs, cheese, and a type of meat.",1.1985
5770,"A steak sourced from choice top loin beef, with 1/8 inch of fat trimmed off.",0.0
5771,"I am having 3 ounces of cooked braised mock tender steak, prepared from lean beef chuck.",0.0
5772,"For a snack, I’m enjoying a thin slice of low sodium white bread.",9.92
5773,A snack consisting of 1 ounce of plain corn-based extruded cones.,17.83215
5774,A regular pouch containing chocolate candy with caramel and nuts.,28.6425
5775,"For dinner, I will be enjoying a large grilled fillet of catfish.",0.0
5776,I possess a single packet of soy sauce with reduced sodium.,0.5031
5777,Consuming a full ounce of pure cranberry juice.,18.0048
5778,"For dinner, I'm enjoying a cup of gluten-free corn pasta.",39.074
5779,A tablespoon filled with canned pimento.,0.612
5780,"Enjoying one ounce of salmon, either baked or broiled and coated.",1.558
5781,I possess 3 ounces of uncooked chicken meat intended for roasting.,0.0
5782,I am consuming 1 fluid ounce of sugar-free Vault energy drink.,0.21
5783,A can of solid canned mushrooms has been opened and drained.,6.7188
5784,"A cup of stewed dried plums, or prunes, sweetened with sugar.",81.5424
5785,A fillet of raw American shad.,0.0
5786,A small thick crust pizza topped with cheese and additional vegetables.,30.912
5787,"A cup of Puerto Rican chicken or turkey fricassee served with sauce, excluding potatoes.",5.6642
5788,I consumed 5 canned prunes along with the syrup they are packed in.,23.908
5789,A cup of cooked frozen collard greens prepared with oil.,12.0225
5790,"A 6-inch B.L.T. sub sandwich made with white bread from SUBWAY, containing bacon, lettuce, and tomato.",39.4568
5791,"A serving of Mother's loaf prepared with pork, weighing 1 ounce.",2.134755
5792,"For dinner, I am enjoying a cup of sweet white corn from a can.",40.824
5793,A sweet popcorn chip is being enjoyed.,0.7459
5794,Enjoying 10 sheets of raw laver seaweed as a light snack.,1.3286
5795,A 4-ounce jar of Beech-Nut Stage I strained vegetable baby food featuring carrots is on my menu.,6.78
5796,"Half of a roasted chicken, with both the bone and skin taken off.",0.0
5797,A microwavable cup containing pasta served with seafood and a tomato-based sauce for dinner.,40.47
5798,A package of dry mix for creamy chocolate frosting is being utilized to create treats.,356.96
5799,A cup filled with semisweet chocolate chips that contain butter.,115.388
5800,"Preparing 4 ounces of raw oyster blade beef from New Zealand, featuring both lean meat and fat.",0.0
5801,Enjoying a cup of coffee that has been pre-lightened and pre-sweetened.,19.0092
5802,Consuming 4 ounces of raw choice beef that has been trimmed to zero fat.,0.0
5803,"Enjoying a cup of shrimp creole on its own, without rice.",11.07
5804,Enjoying a cup of rutabagas that have been mashed and cooked without any salt.,16.416
5805,"For cooking, I am utilizing a teaspoon of industrial palm oil and palm kernel filling fat.",0.0
5806,I am serving 3 ounces of simmered giblets from a broiler chicken.,0.0
5807,"A thick crust pizza topped with cheese and extra vegetables, sized at one square inch.",2.3552
5808,I’m snacking on a large raw red bell pepper.,9.8892
5809,"A small slice of fresh cantaloupe, roughly 1/8 of a small melon.",4.488
5810,Savoring a small iced latte prepared with nonfat milk.,10.152
5811,A small soft pretzel is being enjoyed.,43.0156
5812,"Consuming 2 ounces of beer salami, known as Beerwurst, made from a combination of pork and beef.",2.1056
5813,"Enjoying a cup of Virginia peanuts roasted in oil, unsalted, as a snack.",28.3998
5814,Consuming a cup of fat-free buttermilk.,11.6876
5815,A cup of smoked salmon is what I'm enjoying for lunch.,0.0
5816,I am eating 1 ounce of rotisserie chicken with the skin.,0.02835
5817,"For breakfast, I consumed 0.75 cup of MALT-O-MEAL Fruity DYNO-BITES.",24.327
5818,A commercially made medium oatmeal cookie that meets specific dietary requirements.,4.893
5819,A small piece of fondant candy coated in sweet chocolate.,8.844
5820,"A pound of broiled outside skirt steak, trimmed of excess fat.",0.0
5821,"Enjoying a cup filled with raw white grapefruit segments from Florida, including the juice.",18.837
5822,A jar of NFS baby toddler food.,9.988
5823,Enjoying a fun size candy that is not chocolate.,14.3535
5824,A jar of pear-flavored strained fruit baby food is what I'm enjoying.,12.204
5825,Enjoying a 1-ounce portion of perch fish that has been either baked or broiled and coated.,1.558
5826,A 12 fluid ounce bottle of DASANI water is being consumed.,0.0
5827,I am providing a tablespoon of Stage 1 Baby Toddler apples for my toddler.,1.62
5828,"A side dish consisting of a cup of raw, chopped cowpea leafy tips.",1.7352
5829,A cup of chow mein featuring noodles and meat.,24.53
5830,"A cup filled with raw oranges, including their peels, is my snack.",26.35
5831,"I am providing a scoop of MEAD JOHNSON Enfamil Reguline Powder infant formula to my baby, which contains ARA and DHA and is not mixed with water.",4.8633
5832,"A cup of cooked and drained mustard greens, boiled and seasoned with salt.",4.665
5833,Providing a tub of Stage 2 Baby Toddler mixed vegetables for my baby.,10.516
5834,"A serving of fried chicken featuring the meat, skin, giblets, and neck from a broiler or fryer, all cooked with flour.",6.9324
5835,A cup of strained baby food made with vegetables and brown rice.,27.83
5836,A 4.5-ounce jar of strained turkey dinner with vegetables is being provided to my baby.,8.6106
5837,"A 3-ounce portion of cooked and broiled bone-in center rib pork chop, derived from the separable lean section.",0.0
5838,"A cup of fish shish kabob accompanied by vegetables, excluding potatoes.",7.6846
5839,"A small burrito packed with meat, beans, and rice, without cheese.",60.038
5840,"For dinner, I am consuming 3 ounces of grilled eye of round steak.",0.0
5841,"A 3-ounce grilled top loin steak, carefully trimmed to an eighth of an inch of fat.",0.0
5842,"Consuming a cubic inch of canned Atlantic sardines in oil, with the solids drained and bones included.",0.0
5843,I am consuming 1 ounce of whole milk mozzarella cheese.,0.6804
5844,A waffle created using NFS french fries.,1.8584
5845,"For my meal, I am enjoying a slice of thick crust pizza with cheese and fruit toppings.",46.155
5846,A burrito bowl filled with beef and rice.,38.313
5847,"A cup of toasted sunflower seed kernels, no salt added.",27.5906
5848,A regular egg sandwich served on a griddle pancake with meat.,28.08
5849,Utilizing a quarter cup of whole wheat pancake mix for pancake preparation.,28.1618
5850,"A cheese omelet filled with meat and tomatoes, accompanied by added fat.",1.722
5851,"For dinner, I will be having a chicken thigh that has been stripped of its bone and skin.",0.0
5852,"A piece of chuck arm pot roast, cooked and trimmed to an eighth of an inch of fat.",0.0
5853,Sipping on a cup of frozen mocha coffee prepared with non-dairy milk.,32.0416
5854,I possess a single NLEA serving of raw navel oranges.,18.7418
5855,"A cup of apricots packed in heavy syrup, both skinless and pitless.",55.341
5856,Consuming a tablespoon of junior fruit baby food made with pears and pineapple.,1.824
5857,"For dinner, I am enjoying 3 ounces of grilled boneless top loin steak.",0.0
5858,"Preparing a 4-ounce choice porterhouse steak, trimmed to an eighth of an inch of fat, from the short loin.",0.0
5859,I am feeding my baby 1 fluid ounce of ABBOTT NUTRITION SIMILAC SENSITIVE lactose-free liquid concentrate formula enriched with ARA and DHA.,4.1602
5860,Enjoying a HERSHEY'S PAYDAY Bar as my snack.,27.4976
5861,A fun size chocolate candy enjoyed as a snack alongside some cereal.,10.6455
5862,"I have 3 ounces of mixed species clams from a can, fully drained and prepared for consumption.",5.015
5863,"A cup of cooked elbow macaroni, enriched and prepared without any added salt.",37.032
5864,Utilizing a cup of fully hydrogenated soy oil for my cooking.,0.0
5865,Enjoying a cubic inch of chocolate cake topped with chocolate icing from the bakery.,3.553
5866,A can of cooked green beans prepared with oil.,0.2394
5867,A cup of sautéed frozen greens that include added fat.,9.7825
5868,"A cup of seasoned ground beef prepared in a Mexican style, served with potatoes.",12.3876
5869,"A 4-ounce raw t-bone steak sourced from the short loin, with fat trimmed to an eighth of an inch.",0.0
5870,"A small boiled potato, freshly cooked with oil, without the peel.",26.585
5871,"For dinner, I'm enjoying 1 ounce of steamed perch.",0.0
5872,Enjoying a serving of frozen reduced-fat beef macaroni with tomato sauce.,48.3931
5873,"Consuming a baked chicken leg portion of 1 ounce, which includes both the drumstick and thigh with the skin.",1.12833
5874,"A medium boiled potato, prepared and ready for heating.",34.765
5875,I possess a regular pie crust that has been baked and refrigerated.,115.8696
5876,"I plan to prepare 3 ounces of raw chicken, which comprises the meat, skin, giblets, and neck.",0.1105
5877,Consuming an ounce of fruit-flavored baby food that contains applesauce and apricots.,3.5154
5878,A cubic inch of boneless Atlantic kippered herring is what I'm enjoying.,0.0
5879,"A serving of 3 ounces of broiled lamb shoulder, carefully cooked and trimmed to 1/8 inch of fat.",0.0
5880,"For dinner, I'm consuming a jar of strained baby food that includes vegetables and beef.",9.9892
5881,"A cup of stewed chicken, chopped or diced, consisting of the meat, skin, and giblets.",0.0
5882,"A slice of canned pineapple in light syrup, approximately 3 inches wide, including the syrup.",6.456
5883,A small hamburger slider purchased from a fast food restaurant.,14.59
5884,Dinner consists of a roasted boneless beef tenderloin.,0.0
5885,"For dinner, I am enjoying a slice of chicken topped with gravy.",0.3476
5886,"For a snack, I'm having a single black olive.",0.302
5887,"For breakfast, I am enjoying a slice of toasted oatmeal bread.",13.25
5888,"For dinner, I am having 3 ounces of cooked, braised pork loin sirloin chops with the bone.",0.0
5889,A cup of canned blueberries packed in heavy syrup.,56.4736
5890,"For my meal, I am enjoying half a cup of boiled and drained chopped broccoli without any salt.",5.6004000000000005
5891,"Enjoying a snack of multigrain potato chips, weighing 1 ounce.",18.52389
5892,A single spear of canned asparagus sautéed in oil.,0.3824
5893,"For dinner, I am enjoying a whole cooked artichoke.",14.4625
5894,A cup of raw sprouted mung beans is my choice for today.,6.1776
5895,"A cooked piece of braised lamb shoulder, trimmed to 1/8 inch of fat.",0.0
5896,A cup filled with light cream.,8.784
5897,Enjoying a cup of chilled orange juice prepared from concentrate.,28.7346
5898,A serving of grilled catfish weighing 1 ounce.,0.0
5899,"I have an ounce of unsalted, assorted flavored wheat-based nuts, excluding macadamia.",5.893965
5900,"A standard piece of chocolate cake topped with white icing, prepared from a mix.",53.13
5901,Utilizing a teaspoon of baking soda for leavening purposes.,0.0
5902,Enjoying a single Parmesan garlic breadstick from Pizza Hut.,19.1264
5903,"For a snack, I enjoyed three soft squares made with fruit and nuts.",31.0002
5904,"A light pomegranate juice drink, 1 fluid ounce, with 40-50% juice content.",3.939
5905,"A piece of braised beef chuck blade roast, trimmed to zero fat.",0.0
5906,Providing my baby with 1 fluid ounce of ready-to-feed ENFAMIL Enfacare infant formula that includes ARA and DHA.,2.38084
5907,I am incorporating one tablespoon of dried parsley into my dish as a seasoning.,0.8102400000000001
5908,"For breakfast, I enjoyed a single patty made of pork and beef sausage.",0.84
5909,"A serving of Milky Way Caramels by MARS SNACKFOOD US, featuring 5 pieces wrapped in milk chocolate.",30.1356
5910,"Enjoying a soft granola bar topped with milk chocolate and peanut butter, weighing 1 ounce.",15.1389
5911,Enjoying a slice of pork steak that is coated for dinner.,2.16
5912,A cup of green tea infused with ginseng and sweetened with honey.,18.616
5913,"A cup of self-rising, degermed, and enriched yellow cornmeal is being consumed.",103.2102
5914,Preparing a raw half chicken that includes separable fat.,0.0
5915,I enjoyed 1 ounce of freshly baked French fries.,2.901
5916,A submarine sandwich packed with egg whites and meat.,43.4265
5917,"For dinner, I am enjoying a cup of gizzard.",0.0
5918,Incorporating a tablespoon of freshly chopped raw chives into my dish to enhance the flavor.,0.1305
5919,A cooked braised pork shoulder steak weighing approximately 249 grams.,0.0
5920,A serving consisting of two sliced chicken breasts that have been oven-roasted and are fat-free.,0.9114
5921,"I prepared a cup of omelet containing eggs and assorted vegetables, excluding dark greens and tomatoes.",2.025
5922,"For dinner, I'm enjoying a small regular fillet of catfish.",10.548
5923,I possess a raw emu fan fillet.,0.0
5924,"Preparing a raw top sirloin cap steak weighing 4 ounces, trimmed to an eighth of an inch of fat.",0.0
5925,A cup filled with chocolate candy coated in a candy shell and mixed with nuts.,96.272
5926,A jar of strained lamb meat baby food is on my menu.,0.6035
5927,"For breakfast, I am consuming a large whole raw egg.",0.36
5928,"For lunch, I am enjoying a can of CAMPBELL'S CHUNKY New England Clam Chowder.",46.7619
5929,"Consuming a portion of grilled boneless tenderloin steak, weighing 3 ounces and trimmed of fat.",0.0
5930,Sipping on a cup of orange breakfast drink that is ready to consume and fortified with nutrients.,33.396
5931,"For dinner, I am enjoying fried shrimp.",2.482
5932,"A portion of half a cooked stewed chicken, featuring dark meat with the skin and bone taken off.",0.0
5933,"Consuming a portion of grilled top loin steak weighing 3 ounces, cooked and trimmed of fat.",0.0
5934,Preparing 1 fluid ounce of organic powdered infant formula mixed with water for my baby.,2.1716
5935,"For lunch, I am enjoying a can of New England clam chowder that is ready to serve.",30.2176
5936,I possess a single raw ZESPRI SunGold kiwifruit.,12.7899
5937,Using half a cup of raw chopped endive as the foundation for my salad.,0.8375
5938,"A cup of nonfat dry cottage cheese, available in either large or small curd.",9.657
5939,"Enjoying a jar of strained vegetable baby food containing carrots, weighing 4 ounces.",6.78
5940,A serving of Pillsbury Golden Layer Buttermilk Biscuits prepared from refrigerated dough.,14.0012
5941,A glass of dry dessert wine measured at one fluid ounce.,3.44265
5942,A serving of 1 ounce of cooked stewed chicken breast with skin.,0.0
5943,A tablespoon of Stage 2 Baby Toddler apples is being served to my toddler.,1.545
5944,"For dinner, I am enjoying a salmon croquette.",3.791
5945,"I am having a single piece of grilled chicken, prepared skinless and without sauce.",0.0
5946,Consuming 1 ounce of dry bulgur without any added fats.,21.252
5947,A 15 fluid ounce bottle of light coffee is what I am drinking.,26.595
5948,"For my meal, I ordered a medium pancake accompanied by fruit from a fast food establishment.",14.91
5949,A medium dosa filled with ingredients is my meal.,82.236
5950,A small NESTLE BUTTERFINGER Bar is being enjoyed.,5.103
5951,A cup of fruit juice containing over 3% juice and enriched with vitamin C.,27.013
5952,"Enjoying 3 ounces of cooked lamb from New Zealand, which is imported and previously frozen.",0.0
5953,"I possess a cup of industrial oil, consisting of a blend of partially hydrogenated soy and palm oils, typically utilized for icings and fillings.",0.0
5954,Enjoying a cup of pecan pie as my dessert.,124.075
5955,Dinner consists of a cup of stewed potatoes.,49.775
5956,"For lunch, I am enjoying a slice of BIG DADDY'S 16-inch Whole Grain Turkey Pepperoni Pizza.",42.666
5957,Enjoying a cup of vitamin C-rich fruit juice drink that includes added calcium.,30.0
5958,"In my cooking, I am incorporating a tablespoon of avocado oil.",0.0
5959,Enjoying a full 14-inch cheese stuffed crust pizza from Pizza Hut.,281.1
5960,"Utilizing a tablespoon of a yogurt-infused margarine alternative that contains 70% fat and is salted, available in stick form.",0.07
5961,Spreading a tablespoon of vegetable oil margarine with salt on my toast.,0.0
5962,Enjoying a cup of cooked canned asparagus with added fat.,5.8555
5963,"For a snack, I'm enjoying one ounce of caraway cheese.",0.8675100000000001
5964,Dinner consists of a cup of meatless lo mein.,40.32
5965,"A cup of pasta accompanied by a meat and tomato sauce, along with assorted vegetables from the restaurant.",43.775
5966,"A cup of soupy rice prepared with chicken, following Puerto Rican style, and served boneless.",35.4105
5967,I'm savoring a raspberry Danish pastry measuring approximately 4.25 inches across.,33.938
5968,I possess a cup of sorghum grains.,138.4128
5969,"For lunch, I am enjoying a single meatless meatball.",1.44
5970,"For breakfast, I'm enjoying a cup of QUAKER Puffed Wheat cereal.",11.4585
5971,Enjoying a one fluid ounce serving of white Pinot Blanc wine.,0.56842
5972,A 12 fluid ounce bottle of carbonated fruit juice that is non-citrus is being enjoyed.,28.7928
5973,"Consuming a single canned European anchovy, which is drained and packed in oil.",0.0
5974,"A half cup of chopped green sweet peppers, boiled and seasoned with a pinch of salt.",5.6212
5975,A hard pretzel coated in yogurt.,3.0624
5976,"A tablespoon of salted regular margarine containing 80% fat and enriched with vitamin D, presented in stick form.",0.098
5977,A quarter cup of ready-to-serve mild red enchilada sauce is being used.,2.7272
5978,"For dinner, I am enjoying a large perch fillet.",15.822
5979,Enjoying a personal-sized apple pie as my dessert.,56.325
5980,"A medium slice of toasted bread, which could be homemade or purchased from a bakery.",22.092
5981,"A 2-ounce portion of Hormel Spam, a canned mixture of pork and ham.",2.576
5982,"Preparing 1 ounce of raw leg of lamb, focusing on the shank half trimmed to a quarter inch of fat.",0.0
5983,Consuming a tablespoon of tahini derived from sesame seeds.,3.225
5984,"For dinner, I'm enjoying a roasted chicken thigh made from dark meat, skin removed.",0.0
5985,"For dinner, I'm enjoying a fried chicken thigh without the skin.",7.2912
5986,"For breakfast, I'm enjoying a prepackaged single serving of flavored shredded wheat cereal.",23.676
5987,"I have a 4-ounce portion of raw choice beef brisket, specifically the flat half, trimmed to an eighth of an inch of fat.",0.0
5988,I opened a can containing white tuna that was packed in water and then drained.,0.0
5989,A cup of oil-roasted cashew nuts sprinkled with salt is my snack.,38.9064
5990,A large nonfat frozen mocha coffee topped with whipped cream.,77.81
5991,Consuming 1 fluid ounce of clam and tomato juice from a can.,3.3069
5992,Enjoying a half-cup portion of light vanilla soft-serve ice cream.,19.184
5993,Incorporated a teaspoon of onion powder into my dish to enhance its flavor.,1.89888
5994,"Enjoying a cup of seafood stew filled with potatoes, carrots, broccoli, and dark-green leafy vegetables in a tomato sauce.",15.7248
5995,"A pound of raw lamb foreshank, trimmed to an eighth of an inch of fat.",0.0
5996,"A serving of 3 ounces of broiled round beef, trimmed to a quarter inch of fat.",0.0
5997,Enjoying a cup of fresh celery juice.,7.0092
5998,Enjoying a fluid ounce of light fruit juice lemonade.,1.55
5999,A package of frozen asparagus weighing 10 ounces.,11.644
6000,A container of SILK Key Lime soy yogurt is being enjoyed.,30.005
6001,Enjoying a cup of steamed mature sprouted soybeans seasoned with a touch of salt.,6.1382
6002,Enjoying a kernel of popcorn with a butter flavor as a snack.,0.10676
6003,A cup of cooked grits topped with cheese is my breakfast.,27.264
6004,A side dish consisting of a cup of raw sliced enoki mushrooms.,5.0765
6005,"A medium slice of Challah bread, toasted and topped with egg.",14.7084
6006,A portion of domesticated rabbit that has been cooked in a stew.,0.0
6007,Preparing a 4-ounce portion of raw Australian ground lamb that is 85% lean and 15% fat.,0.0
6008,Enjoying half of a pink and red grapefruit sourced from either California or Arizona.,11.9187
6009,I possess a single fresh turkey egg in its raw state.,0.9085
6010,"For dinner, I will eat 1 ounce of catfish.",2.344
6011,A cup filled with fresh raw pokeberry shoots.,5.92
