,query,carb
1903,A raw mamey sapote fruit is being consumed.,179.118
1904,A hash brown potato patty obtained from the restaurant.,15.884
1905,"A piece of broiled prime top round steak, trimmed to a thickness of 1/8 inch fat.",0.0
1906,A cup of canned peas and carrots with added fat.,13.5465
1907,"For breakfast, I am enjoying a bowl of MALT-O-MEAL Tootie Fruities cereal.",27.5008
1908,A small raw ear of sweet white corn.,13.8846
1909,"A cup of boiled cowpeas leafy tips, cooked and drained, served without salt.",1.484
1910,"For dinner, I am enjoying a cup of rice and pork served with a tomato sauce.",40.9432
1911,"A serving of Monster energy drink enriched with vitamins C, B2, B3, B6, and B12.",27.072
1912,A cup of boiled and salted edible-podded peas is being enjoyed.,10.336
1913,"For cooking, I am utilizing 1 tablespoon of mustard oil.",0.0
1914,"A broiled top round steak, cooked and trimmed to a fat thickness of 1/8 inch.",0.0
1915,"For dinner, I'm enjoying a grilled cooked inside skirt steak.",0.0
1916,AQUAFINA water served in a 16.9 fluid ounce bottle.,0.0
1917,"For dinner, I'm using a package of 10 ounces of cooked and drained frozen immature pinto beans.",87.6708
1918,A toasted medium slice of whole wheat bread studded with raisins.,13.6224
1919,"A serving of Iced Molasses cookies from Archway, enjoyed as a treat.",19.3536
1920,A cup of low linolenic soy oil is being utilized for cooking.,0.0
1921,A snack consisting of 8 mini higher fat vanilla wafers.,8.4216
1922,A large iced decaffeinated coffee beverage prepared with non-dairy milk.,84.382
1923,I possess a 4-ounce raw bone-in leg chop from New Zealand lamb.,0.0
1924,"Enjoying a portion of banana cream pie, weighing 1 ounce, made from a recipe.",9.32715
1925,"For lunch, I am enjoying a cup of canned white beans.",55.544
1926,"For breakfast, I am enjoying a silver dollar pancake adorned with fruit.",6.126
1927,"A cup filled with sliced raw golden delicious apples, skin included.",14.824
1928,A piece of roasted chicken back served with both meat and skin.,0.0
1929,"For dinner, I am enjoying 3 ounces of heated, roasted bone-in ham.",0.9775
1930,"Consuming a portion of dry wheat bran muffin mix, weighing 1 ounce.",20.6955
1931,A one-egg omelet prepared with mixed meat.,0.7425
1932,A cup of drained canned straw mushrooms is my choice.,8.4448
1933,"A portion of raw boneless pork loin blade weighing 4 ounces, consisting of both lean meat and fat.",0.8588
1934,An extra large glazed doughnut measuring approximately 5 inches across.,58.4746
1935,"For dinner, I will enjoy 3 ounces of cooked bottom round roast beef.",0.0
1936,"Enjoying a cup of prepared whole grain pasta, primarily made from whole wheat and a bit of unenriched semolina.",36.8667
1937,"For dinner, I'm enjoying a cup of seasoned shredded meat in soup.",4.7747
1938,A cup of cooked brown and wild rice enhanced with added fat.,37.6805
1939,"For dinner, I'm enjoying 3 ounces of grilled top round steak.",0.0
1940,Enjoying a cup of chocolate milk prepared with dry mix and reduced fat milk.,25.172
1941,Dinner consists of a cup of lasagna featuring either chicken or turkey.,35.025
1942,A 4-ounce raw top round beef steak with a fat trim of 1/8 inch.,0.0
1943,"For breakfast, I'm enjoying a biscuit topped with egg and ham.",29.7934
1944,"A large boiled potato, with the skin consumed and no additional fat.",63.21
1945,An 8-ounce bottle containing GERBER GRADUATES FRUIT SPLASHERS baby food drink.,16.6845
1946,A small individual bag of popcorn chips featuring a variety of flavors.,20.7704
1947,"For dinner, I'm consuming 4 ounces of fresh raw pork brain.",0.0
1948,"A grilled chicken leg quarter, consisting of a drumstick and thigh, served without skin.",0.0
1949,I prepared an entire batch of praline candies homemade.,540.4813
1950,"Consuming 1 ounce of T-bone steak, which includes both the lean and fatty sections.",0.0
1951,A 3-ounce portion of broiled top sirloin steak without any fat.,0.0
1952,Enjoying a refreshing Seabreeze drink.,2.469
1953,A cup of raw chopped cauliflower is my snack.,5.3179
1954,Dinner consists of a can of sweet yellow cream-style corn.,87.3866
1955,"A chilled graham cracker pie crust, measuring 9 inches, has been prepared according to a recipe.",155.916
1956,A quarter cup of HEINZ Home Style classic chicken gravy is being served.,2.9058
1957,Consuming 1 fluid ounce of reduced fat milk enriched with vitamins A and D.,1.496025
1958,Enjoying a cup of perch that has been baked or broiled and coated.,10.5165
1959,"For dinner, I'm enjoying a cup of clams from a can.",10.035
1960,A large bag of popcorn that is ready to eat.,45.373
1961,"A 4-ounce bone-in rib eye steak, trimmed to a fat thickness of 1/8 inch.",0.0
1962,A cup of cooked frozen kale without any added fat.,8.975999999999999
1963,"I am preparing 100 ml of ready-to-feed MEAD JOHNSON Pregestimil infant formula for my baby, which contains ARA and DHA.",6.188
1964,"A cup of canned bean and ham soup, ready to eat.",33.467
1965,Enjoying a serving of gingerbread cake in a cup as dessert.,45.34
1966,"For dinner, I have a cup of noodles and shrimp served with gravy.",32.928
1967,A single whole cooked mushroom prepared without any added fat.,0.6695
1968,"Enjoying a snack-sized microwavable tray of Spaghettios featuring whole grain pasta, cream sauce, poultry, and assorted vegetables.",27.489
1969,"I am enjoying a single piece of buñuelos, a fried yeast bread from a Latino eatery.",33.999
1970,"A steak prepared from the lean, cooked, and broiled round of elk.",0.0
1971,A pat of margarine-oil blend is being utilized for cooking.,0.049
1972,Sipping on a fluid ounce of citrus juice served over ice.,3.534
1973,"Cooking a boneless top round steak weighing 4 ounces, with the fat trimmed.",0.0
1974,Enjoying a cup of gluten-free bread.,4.578
1975,A cup of black beans served with rice from a fast food place.,40.222
1976,"A serving of 3 ounces of broiled choice lamb rib, trimmed to a quarter inch of fat.",0.0
1977,"For my meal, I've prepared a cup of cooked amaranth grain.",45.9774
1978,Five balls of gefilte fish served for my dinner.,3.5834
1979,I possess 3 ounces of uncooked Atlantic cod.,0.0
1980,"A tablespoon of cooked, roasted broiler chicken is being enjoyed.",0.0
1981,A tablespoon of fat-free ranch dressing is added to my salad.,3.7114
1982,"A raw boneless tenderloin steak weighing 4 ounces, sourced from the beef loin and trimmed to zero fat.",0.0
1983,"For dinner, I am getting ready to cook a raw lamb chop from New Zealand, which has been trimmed to 1/8"" of fat and weighs approximately 85 grams.",0.0
1984,A serving of dry whole-wheat pasta shells for dinner.,46.9568
1985,"A packet of instant oats made with water, containing raisins and a blend of spices.",28.2978
1986,"For dinner, I am serving a cooked boneless top loin petite roast, trimmed to 1/8 inch of fat.",4.2254
1987,A cup of limeade with a high caffeine content is being consumed.,10.3983
1988,"A broiled beef patty weighing 3 ounces, made of 93% lean meat and 7% fat.",0.0
1989,Enjoying a single plain hard pretzel stick that is gluten-free.,0.7862
1990,A snack-sized stick of hard whole wheat breadstick.,1.358
1991,Enjoying a cup of drained boiled white mushrooms without any salt.,8.2524
1992,A small gluten-free roll is what I'm having.,14.1316
1993,Enjoying a complete circular chicken quesadilla loaded with vegetables.,45.04
1994,"For dinner, I'm enjoying a slice of heated bone-in ham that was pan-broiled.",2.7084
1995,A cup of homemade hummus is being enjoyed as a snack.,49.4952
1996,A hamburger sandwich featuring a regular-sized patty and various condiments.,28.6829
1997,Enjoying one fluid ounce of Fume Blanc white table wine.,0.6651100000000001
1998,Consuming 1 ounce of junior vegetable baby food featuring green beans.,1.6443
1999,Dinner includes a cup of groundhog.,0.0
2000,Enjoying a half cup of barley soup with condensed mushroom.,12.096
2001,"A serving of broiled porterhouse steak, trimmed to have no fat, from the short loin.",0.0
2002,"Consuming a beverage made from citrus fruits, containing 40-50% juice, with a volume of 1 fluid ounce.",2.622
2003,"For dinner, I'm eating 3 ounces of cooked skipjack tuna.",0.0
2004,A slice of pre-packaged white bread.,14.3318
2005,"A pound of raw pork leg, specifically the shank half, containing both lean and fatty portions.",0.0
2006,A small beef patty is being enjoyed for my meal.,0.0
2007,Half a fillet of lingcod that has been cooked using dry heat.,0.0
2008,"Consuming 1 ounce of raw bison top sirloin, carefully trimmed to remove all fat.",0.0
2009,Enjoying a slice of marble cake as my dessert.,91.9975
2010,Consuming 2 tablespoons of frosting made with chocolate glaze and butter.,23.8194
2011,"For lunch, I am enjoying a jar of strained baby food made from vegetables and carrots.",4.26
2012,An 8-ounce serving of V8 V-FUSION juice in peach mango flavor.,27.9948
2013,"Consuming a 1-ounce plain bagel topped with onion, poppy, and sesame seeds.",14.84973
2014,"For dinner, I'm enjoying a generous portion of stewed potatoes prepared in Puerto Rican style.",46.2878
2015,Savoring a single medium bag of popcorn flavored with butter.,30.4266
2016,Using a tablespoon of teriyaki sauce that is ready to serve.,2.8008
2017,Enjoying a single cooked cauliflower floweret with additional fat.,0.6526000000000001
2018,"A cup of ravioli filled with cheese, served plain without sauce.",34.768
2019,A cup of macaroni and cheese from the children's menu at Denny's.,28.3544
2020,A quarter cup of drained boiled leeks without any added salt is being consumed.,1.9812
2021,"A bite-sized soft pretzel, previously frozen and sprinkled with salt.",9.8084
2022,"I prepared a fruit punch juice drink using frozen concentrate and mixed it with water, totaling 1 fluid ounce.",3.3402
2023,"For my meal, I am enjoying a rectangular piece of frozen school lunch pizza topped with cheese, served on a thin whole grain crust measuring approximately 4 by 6 inches.",40.703
2024,Enjoying a 12 fluid ounce light beer that has a higher alcohol content.,2.7412
2025,"A boneless top loin petite roast filet, trimmed to have 1/8 inch of fat.",0.0
2026,A raw pork loin tenderloin roast weighing 504 grams.,0.0
2027,Dinner consists of a grilled boneless rib eye steak.,0.0
2028,A cup filled with sliced low sodium frankfurters.,2.718
2029,I am consuming 1 ounce of baked chicken without the skin.,0.0198449999999999
2030,"For lunch, I'm enjoying a can of New England clam chowder.",31.2696
2031,"For dessert, I am enjoying a slice of cake.",93.8
2032,A tablespoon of junior tutti frutti fruit baby food is being consumed.,2.4
2033,A small slice of soy bread that has been toasted.,11.525
2034,A jar of junior dinner baby food containing vegetables and turkey is being served to my baby.,12.835
2035,Enjoying 3 ounces of cooked broiled round beef with 1/8 inch fat trimmed.,0.0
2036,"A serving of 3 ounces of lean, cooked, braised New Zealand lamb breast.",0.0
2037,One fluid ounce of pure lemon juice served chilled with ice.,1.2926
2038,"I possess a 4-ounce portion of raw bottom sirloin tri-tip roast, trimmed to be completely fat-free.",0.0
2039,I plan to prepare a package of frozen chopped collards weighing 3 pounds.,87.9206
2040,A jumbo beef hot dog served in a bun.,1.6473
2041,"For breakfast, I am enjoying 1 ounce of cooked pork and beef sausage.",0.6804
2042,"A choice top round steak, boneless and trimmed to zero fat, is prepared for cooking.",0.0
2043,A package containing TWIX bars with a peanut butter cookie flavor.,144.5538
2044,"For dinner, I am enjoying a single cooked and broiled bone-in pork chop.",0.0
2045,"I am having an ounce of rotisserie chicken breast seasoned with original spices, fully cooked and prepared for eating.",0.00567
2046,"For lunch, I'm enjoying a cup of chicken or turkey salad prepared with light mayonnaise.",10.5768
2047,"I possess a 4-ounce portion of boneless Australian lamb tenderloin, trimmed to 1/8 inch of fat.",0.0
2048,Enjoying a cup of Puerto Rican green plantain accompanied by cracklings.,53.94
2049,Consuming a tablespoon of peanut butter enriched with vitamins and minerals.,3.0
2050,Enjoying a regular slice of blueberry pie as my dessert.,56.925
2051,"Consuming one fluid ounce of light cranberry juice drink enriched with high vitamin C, served without ice.",11.28
2052,Enjoying a 6 fluid ounce can of unsweetened white grapefruit juice made from frozen concentrate.,71.5392
2053,A single soft pretzel stick that is gluten-free and has a coating or flavor.,11.3715
2054,"Enjoying a cup of vegetable beef soup, made with an equal ratio of water.",9.9064
2055,"A side dish of cooked baby corn, prepared without any added fat.",1.5392
2056,"A serving of cooked braised dark meat chicken thigh with skin, weighing 3 ounces.",0.1785
2057,A standard slice of chocolate cake topped with chocolate icing from the bakery.,60.0875
2058,"For dinner, I am having a cup of beef brisket.",0.0
2059,A slice of Puerto Rican bread spread with lard.,14.025
2060,I have three ice cubes made from tap water sourced from the municipal supply.,0.0
2061,"A cup filled with chicken or turkey, noodles, and assorted vegetables including carrots, broccoli, and dark-green leafy greens, all generously topped with cheese sauce.",34.5504
2062,"A small baked potato, complete with its flesh and skin, lightly salted.",29.187
2063,"For a snack, I'm enjoying 1 ounce of low-fat cheddar cheese.",0.541485
2064,Enjoying an extra large pancake adorned with fruit.,45.945
2065,"For my toddler, I'm serving a tablespoon of Stage 2 peas.",1.254
2066,"I am consuming 3 ounces of BBQ chicken, specifically from the back meat of the rotisserie.",0.2635
2067,"A cup filled with cooked, diced chicken drumstick, skin discarded.",0.0
2068,"For dinner, I'm enjoying a serving of steamed salmon weighing 1 ounce.",0.0
2069,Utilizing a single container of butter-oil blend for cooking purposes.,0.0
2070,A slice of raw jicama is being enjoyed as a snack.,0.5292
2071,"For dinner, a serving of Oscar Mayer beef franks is on the menu.",1.251
2072,A sundae topped with hot fudge.,57.456
2073,"Consuming 1 ounce of cooked chicken, prepared by baking, broiling, or roasting, including the skin.",0.0
2074,"For dinner, I will be consuming 4 ounces of raw tripe.",0.0
2075,A cooked green bean that is fresh and prepared with oil.,0.4218
2076,An egg sandwich made with white bread and cheese.,46.781
2077,Consuming 2 tablespoons of smooth peanut butter that is free from salt.,7.1392
2078,"For dinner, I am enjoying a serving of spaghetti topped with meat sauce from the freezer.",43.1292
2079,"For dinner, I am having a cubic inch of perch, either baked or broiled.",0.0017
2080,A ZONE PERFECT CLASSIC CRUNCH BAR featuring a mix of flavors.,22.5
2081,"A tablespoon of raw coconut cream, derived from the liquid of grated coconut meat.",0.9975
2082,"I am enjoying a single cooked pork chop, pan-fried and bone-in, sourced from the center rib loin.",0.0
2083,"For my meal, I have a portion of cooked, braised fresh pork shoulder totaling 3 ounces, derived from blade steaks.",0.0
2084,A cup of saltine oyster crackers enjoyed as a snack.,33.3225
2085,"A cup filled with canned strawberries in thick syrup, comprising both the fruit and the syrup.",59.7662
2086,A slice of dried currants is my snack.,0.3849
2087,"In my recipe, I am incorporating a tablespoon of soybean lecithin oil.",0.0
2088,A cup filled with cooked bulgur.,33.8156
2089,A barbecue pork sandwich served on a wheat bun.,63.693
2090,A small iced decaf cafe mocha made with non-dairy milk.,32.8848
2091,A small piece of sweet potato bread is what I'm enjoying.,12.7064
2092,I possess one pound of uncooked bone-in cured ham sourced from the rump.,6.1236
2093,I possess a cubic inch of bread that is toasted and made with vegetables.,2.26524
2094,"I am enjoying a 1 fluid ounce smoothie made from fruits, vegetables, and dairy.",3.4398
2095,"I plan to prepare a dish using a single peeled eggplant, weighing approximately 1 to 1.25 pounds.",26.9304
2096,"Consuming a cup of stabilized, dried whole egg with lowered glucose content.",2.023
2097,"For my meal, I’m enjoying a slice of 14-inch Little Caesars Original Round Cheese Pizza with a regular crust.",28.035
2098,"I possess one pound of New Zealand imported lamb foreshank, which has been trimmed to 1/8 inch fat.",0.0
2099,"For my meal, I am serving 3 ounces of cooked and roasted boneless chuck eye roast, which has been trimmed of fat.",0.0
2100,"For a snack, I am enjoying 2 tablespoons of KRAFT CHEEZ WHIZ LIGHT.",5.67
2101,"Sipping on a small Vanilla Shake from Burger King, which is 12 fluid ounces.",56.7094
2102,A small container filled with fat-free blue cheese dressing for dipping.,11.264
2103,A cup of raw chopped broccoli raab is being served as a side dish.,1.14
2104,"For dinner, I'm enjoying a grilled steak sourced from bottom round, with all fat trimmed away.",0.0
2105,I am enjoying a snack of two plain brown rice cakes without salt.,14.67
2106,"A raw roast made from choice beef round tip, trimmed to have no fat.",0.0
2107,Utilizing a tablespoon of light margarine-oil blend from a tub.,0.1708
2108,"A large unenriched plain bagel, seasoned with onion, poppy, and sesame, containing calcium propionate.",69.954
2109,"For dinner, I am enjoying 3 ounces of smoked whitefish.",0.0
2110,"A tablespoon of CANOLA HARVEST Soft Spread margarine is being used, crafted from canola, palm, and palm kernel oils.",0.1946
2111,Enjoying a 1 fluid ounce Shirley Temple.,31.8825
2112,"A serving of chicken meatloaf, weighing 1 ounce, with a tomato sauce topping.",2.066715
2113,"Enjoying a serving of alcoholic eggnog, measured at 1 fluid ounce.",1.986
2114,A cup filled with decaffeinated iced latte made with nonfat milk and flavored.,15.2024
2115,"A cup of cooked and diced grilled chicken, served without sauce and skin.",0.0
2116,"For dinner, I'm enjoying a cup of chimichanga accompanied by beans.",32.16
2117,Adding a teaspoon of industrial canola oil to my salad.,0.0
2118,"A cup of shrimp garden salad containing shrimp, lettuce, eggs, tomatoes, carrots, and a variety of other vegetables, served without dressing.",2.375
2119,"Enjoying a large serving of low calorie cola, totaling 32 fluid ounces, with aspartame and caffeine.",2.0938
2120,"For dinner, I’m enjoying one ounce of fresh raw pork jowl.",0.0
2121,A tablespoon of homemade jelly with reduced sugar is being enjoyed.,8.759
2122,A cup of reduced fat 2% milk enriched with vitamin A and D.,11.13435
2123,A cup of enriched spaghetti that has been cooked and seasoned with salt.,37.9316
2124,Dinner consists of a microwavable cup of pasta accompanied by cream sauce and meat.,34.5486
2125,Enjoying 12 fluid ounces of Mixed Berry flavored POWERADE Zero.,0.504
2126,Savoring a commercially made soft chocolate chip cookie.,9.3365
2127,"For dinner, I am enjoying a portion of 3 ounces of braised choice bottom round steak.",0.0
2128,"For lunch, I will be enjoying a can of low sodium cream of mushroom soup.",13.8165
2129,A 10-ounce pouch of SMART SOUP featuring French lentils.,26.885
2130,"For dinner, I am enjoying a large burrito filled with cheese.",68.6025
2131,"For dinner, I'm serving half a cup of boiled and drained cabbage.",4.1325
2132,I plan to prepare a 10-ounce package of frozen baby lima beans.,71.3976
2133,"A grilled t-bone steak, prepared with a fat thickness of 1/8 inch.",0.0
2134,"For cooking purposes, I am utilizing a cup of almond oil.",0.0
2135,A medium-sized rye roll is being enjoyed for dinner.,19.116
2136,"A cup of regular microwave popcorn, flavored with butter and prepared using palm oil.",4.52354
2137,A cup of brewed coffee prepared using tap water.,0.0
2138,A piece of frozen precooked white meat chicken nugget that remains unreheated.,3.248
2139,"For dinner, I'm enjoying 3 ounces of braised and cooked lamb kidneys.",0.8415
2140,"A serving of strained creamed corn baby food, weighing 1 ounce.",3.99735
2141,"Handling half of a raw guinea hen, focusing solely on the meat.",0.0
2142,"For dinner, I am enjoying a drumstick from a BBQ rotisserie chicken.",0.0
2143,"Enjoying a serving of 1 fluid ounce of pure grapefruit juice, served neat.",20.708
2144,Consuming a 1 fluid ounce serving of SoBe Energize Energy Juice.,3.4937
2145,"A square pat of salted butter, measuring roughly 1 inch by 1/3 inch.",0.003
2146,A jelly sandwich prepared with a single slice of bread.,28.75
2147,"Enjoying a slice of Beerwurst, a beer salami made from pork.",0.1236
2148,A package of hard gluten-free pretzels containing 100 calories.,18.765
2149,A cup of pinto beans obtained from a fast food restaurant.,61.412
2150,A single omelet made with one egg and tomatoes.,1.1025
2151,"I prepared a boneless top blade steak from the shoulder, grilled and trimmed of all fat.",0.0
2152,A singles package of macaroni and cheese with meat prepared using Hamburger Helper.,29.5776
2153,A fruit-flavored puff designed for toddlers.,0.08579
2154,"Enjoying three ounces of broiled rib beef, trimmed of all fat from the small end.",0.0
2155,On my plate is a serving of coleslaw from POPEYES.,26.828
2156,"For dinner, a large fried fillet of flounder is on my plate.",15.822
2157,I prepared a single piece of cooked frozen asparagus with oil.,0.0744
2158,I will prepare a raw dark meat chicken thigh with a solution added.,0.0
2159,A tablespoon of cooked lentils that have been boiled and are unsalted.,2.47599
2160,"A cup of fruit punch from a can, enriched with additional nutrients.",29.6112
2161,"A complete fried chicken consisting of meat, skin, giblets, and neck.",23.1516
2162,"For dinner, I'm enjoying a cup of canned green peas blended with butter.",18.216
2163,A portion of 1 ounce of skinless cooked chicken.,0.0
2164,"A serving of pear nectar measured at one fluid ounce, served without ice.",39.0848
2165,"For my meal, I am adding a tablespoon of NFS sauce.",1.8975
2166,"A cup of chicken served with potatoes and a side of mixed vegetables, all drizzled with gravy.",30.9204
2167,"Consuming 4 ounces of raw chicken drumsticks and thighs, enhanced with an added solution.",0.0113
2168,A medium-sized raw green Anjou pear is being consumed.,31.8958
2169,"For dessert, I am enjoying an entire strawberry pie.",707.52
2170,A cup filled with pieces of reduced sodium Spam.,4.76
2171,Enjoying a cup of conch that has been either baked or broiled.,2.159
2172,"A cup of boiled pumpkin flowers, drained and prepared without any added salt.",4.422
2173,Enjoying a tablespoon of caviar as an indulgent delicacy.,0.64
2174,"For dinner, I am enjoying a bowl of oxtail soup.",3.3184
2175,"Consuming an entire head of cabbage that has been boiled and drained, served without any salt.",69.5362
2176,I possess an unprepared package of classic cheeseburger macaroni pasta mix.,87.9573
2177,A skinless fried chicken wing is what I’m having for dinner.,0.7881
2178,A leaf of raw Chinese cabbage is my snack.,0.327
2179,"A cup of canned yellow sweet corn, prepared without any added salt.",35.4816
2180,"A cup of mushroom soup, made using beef stock and an equal amount of water.",9.2964
2181,"A small pre-cooked fried chicken drumstick, without the skin or coating.",0.0
2182,Enjoying a roasted piece of choice lamb loin that has been trimmed to a quarter inch of fat.,0.0
2183,A roast made from fresh center loin pork that has been cooked and roasted.,0.0
2184,"A serving of 3 ounces of broiled rib beef, trimmed to an eighth of an inch of fat.",0.0
2185,"Enjoying a slice of fruit coffeecake, representing one-eighth of the entire cake.",25.75
2186,Three ounces of simmered cooked chicken neck meat.,0.0
2187,"Preparing a 4-ounce boneless ribeye cap steak, trimmed to eliminate all fat, for dinner.",1.9775
2188,"A cup filled with diced Florida oranges, prepared without any membranes.",21.349
2189,"Enjoying half of a roasted chicken, featuring dark meat without the skin.",0.0
2190,"For lunch, I am having a large NFS burrito.",78.705
2191,Enjoying a cup filled with diced fontina cheese as a snack.,2.046
2192,A cup of Puerto Rican style rice soup accompanied by chicken.,54.1863
2193,I am enjoying a Soup at Hand container filled with homemade broccoli soup mixed with water.,11.6909
2194,"A small burrito filled with meat and beans, without any cheese.",54.978
2195,Enjoying a refreshing sloe gin fizz.,0.666
2196,A cup filled with baked French fries made from fresh potatoes.,11.604
2197,"For dinner, I am enjoying a fillet of raw butterfish.",0.0
2198,Enjoying a tart apple pie from a fast food restaurant.,53.25
2199,"A tablespoon of imitation mayonnaise salad dressing, which contains milk cream.",1.665
2200,"For breakfast, I am enjoying a large sandwich made with egg and cheese on white bread.",46.781
2201,A tablespoon of plain Baby Toddler yogurt is being consumed.,0.6990000000000001
2202,"For dinner, I will be enjoying a cup of Mexican pizza.",18.348
2203,A package containing 1.69 ounces of Milk Chocolate M&M's.,34.1712
2204,Enjoying a cup of Golden Maple flavored QUAKER Oatmeal Squares for breakfast.,43.7024
2205,"For dinner, I am using a 4-ounce jar of Heinz Strained baby food, featuring vegetables and chicken.",9.5146
2206,A cup of spaghetti prepared with 51% whole wheat and unenriched semolina.,47.5801
2207,A cup filled with crushed standard snack crackers.,31.876
2208,"A noncitrus carbonated fruit juice drink, one fluid ounce, served over ice.",1.7802
2209,"For dinner, I am having a piece of roasted buffalo meat.",0.0
2210,One portion of cooked canned green beans with added fat.,0.08
2211,"Prepared a breakfast omelet using one egg white, cheese, and a small amount of meat.",1.2546
2212,A bottle of NESTLE Boost Plus nutritional beverage is being consumed.,40.9773
2213,A cup of tres leches cake is my dessert choice.,50.28
2214,A regular bologna sandwich made with white bread.,32.7635
2215,"I prepared a serving of instant lemon pudding, yielding half a cup.",23.85
2216,A heated and roasted shank of cured ham is my meal.,41.229
